id,poster,title,year,rating,genre,action,adventure,animation,comedy,crime,drama,fantasy,horror,mystery,romance,sci-fi,short,thriller,plot
41708,"https://m.media-amazon.com/images/M/MV5BMDNjOWFkZjktMjRhMi00NWZhLWE1N2UtYjU2ZjllM2QxMDdkXkEyXkFqcGdeQXVyOTQxNzM2MjY@._V1_UX256,0,256,256_AL_.jpg",Ice Age 2: The Meltdown,2006,6.8,"action, adventure, comedy",1,1,0,1,0,0,0,0,0,0,0,0,0,"    Manny the woolly mammoth, Sid the sloth, Diego the saber-toothed tiger, and the hapless prehistoric squirrel/rat known as Scrat are still together and enjoying the perks of their now melting world. Manny may be ready to start a family, but nobody has seen another mammoth for a long time; Manny thinks he may be the last one. That is, until he miraculously finds Ellie, the only female mammoth left in the world. Their only problems: They can't stand each other--and Ellie somehow thinks she's a possum! Ellie comes with some excess baggage in the form of her two possum ""brothers""-- Crash and Eddie, a couple of daredevil pranksters and cocky, loud-mouthed troublemakers. Manny, Sid and Diego quickly learn that the warming climate has one major drawback: A huge glacial dam holding off oceans of water is about to break, threatening the entire valley. The only chance of survival lies at the other end of the valley. So our three heroes, along with Ellie, Crash and Eddie, form the most unlikely ..."
41709,"https://m.media-amazon.com/images/M/MV5BMzU1ZTU1NTMtOWQ5OS00M2RhLTllZTktNjdkY2JmYWY3ZTk5XkEyXkFqcGdeQXVyNzQ5MzY0NjM@._V1_UX256,0,256,256_AL_.jpg",Big Nothing,2006,6.8,"comedy, crime, thriller",0,0,0,1,1,0,0,0,0,0,0,0,1,"    Charlie is an ex-professor turned reluctant call center employee who gets fired on the first day. Distraught at being unable to provide for his daughter Emily and wife Penelope, he accepts when Gus, an aspiring scam artist who presents Charlie with a seemingly snag-free plan to make some cash. The plan is to blackmail Reverend Smalls, a man of the cloth, who's frequently turned up in the company database of visitors to illegal porn sites. Gus plans to extort Reverend Smalls, with the intention of publicly exposing his secret shame should he refuse, thus potentially destroying the man's career. Normally cautious, Charlie is keen on participating in this scam, confident that the money he'll make from the scam will finally help turn things around for him and his family. Joined by one-time teenage pageant queen Josie McBroom, Gus's ex, the plan goes ahead, but it all goes wrong as Reverend Smalls dies thanks to this trio, with this only being the start of their troubles."
41710,"https://m.media-amazon.com/images/M/MV5BMTcwMTcyMDcxMV5BMl5BanBnXkFtZTcwNzY1NzI4Mg@@._V1_UX256,0,256,256_AL_.jpg",Princess,2006,6.8,"animation, action, drama",1,0,1,0,0,1,0,0,0,0,0,0,0,"    Due to his sister's death, the 32 year old August returns and consequently abandons his profession as a missionary priest. His beloved sister Christina, who went from greatness to decay as the famous porn-star The Princess, is dead after years of drug abuse. She leaves behind her 5-year old daughter Mia, whom August feels obliged to take care of. Weighed down by grief and guilt he decides to revenge the dead of Christina - and takes Mia on a mission to destroy all existing pornographic material featuring The Princess. The mission escalates into a brutal and violent rout, where August is desperately trying to protect the only precious thing in his life, Mia, why he is forced to make a fatal decision."
41711,"https://m.media-amazon.com/images/M/MV5BMTcxMDk5MTAzM15BMl5BanBnXkFtZTgwNTk0MTAwMTE@._V1_UX256,0,256,256_AL_.jpg",Aachi & Ssipak,2006,6.8,"animation, action, comedy",1,0,1,1,0,0,0,0,0,0,0,0,0,"    In a future where energy is made from fecal matter, the government rewards defecation with ""juicybars"". Small-time hustlers try to get rich while fending off the mutated Diaper Gang."
41712,"https://m.media-amazon.com/images/M/MV5BMjI3NTYwNjAzNV5BMl5BanBnXkFtZTgwNTgwNjcwMzE@._V1_UX256,0,256,256_AL_.jpg",3-2-1 Penguins!,2006,6.8,"animation, short, adventure",0,1,1,0,0,0,0,0,0,0,0,1,0,"    3-2-1 Penguins. is a kids cartoon that teaches kids about the Bible and helps them learn different Bible verses with Zidgel, Midgel, Fidgel and Kevin with the help of Michelle and Jason."
41714,"https://m.media-amazon.com/images/M/MV5BMjE5NTcwNjE0M15BMl5BanBnXkFtZTcwMjc3ODAwMg@@._V1_UX256,0,256,256_AL_.jpg",Strawberry Panic,2006,6.8,"animation, drama, romance",0,0,1,0,0,1,0,0,0,1,0,0,0,"    Aoi Nagisa, a young reddish haired girl, just transfers to an all-girls, catholic school, the Starrawberry Dorms. The school is divided in to three sections (Lulim, Miator, Spica) all in which have there own president, uniforms, and activities. Assigned to Miator, Nagisa attracts the attention of the whole school through a series of incidents involving the Student Etoile (representative of all three parts of the school), Shizuma, a long, silver haired beauty that is the idol of all the other girls. Nagisa and shizuma begin to fall for each other, but slowly a love triangle in unleashed. Soon Nagisa discovers a sad secret of shizuma's recent past which will bring them even closer to each other."
41715,"https://m.media-amazon.com/images/M/MV5BMTQ5MjUyOTMzN15BMl5BanBnXkFtZTcwMzIzMDMzMQ@@._V1_UX256,0,256,256_AL_.jpg",Boy Culture,2006,6.8,"drama, romance",0,0,0,0,0,1,0,0,0,1,0,0,0,"    A successful male escort describes in a series of confessions his tangled romantic relationships with his two roommates and an older, enigmatic male client."
41716,"https://m.media-amazon.com/images/M/MV5BNWNhNzNhZWItYTZlZC00YzY5LTk3OTgtZmM2ZmZlMzFhNTdlXkEyXkFqcGdeQXVyMzM4MjM0Nzg@._V1_UX256,0,256,256_AL_.jpg",Fist of the North Star: New Saviour Legend,2006,6.8,"animation, action",1,0,1,0,0,0,0,0,0,0,0,0,0,"    After a nuclear explosion, the survivors must hide from the terrible Sauzer, who wants to dominate the world. Kenshiro is the only hope"
41717,"https://m.media-amazon.com/images/M/MV5BNTk3YTliODUtZDFiNS00ODFkLTllOWEtNDlkNzUzOGYzZjcxXkEyXkFqcGdeQXVyNTkzNDQ4ODc@._V1_UX256,0,256,256_AL_.jpg",Kabul Express,2006,6.8,"adventure, comedy, drama",0,1,0,1,0,1,0,0,0,0,0,0,0,"    Suhel (John Abraham) and Jai (Arshad Warsi) - TV journalists from India in search of the ultimate news scoop, meeting the Taliban. Imran Khan Afridi (Salman Shahid) - a soldier of the hated and derided Taliban who needs to escape the wrath of the Afghans and run to his country, Pakistan. Khyber (Hanif Hum Ghum) - an Afghan who is as old as the war in his country. Jessica Beckham (Linda Arsenio) - an American photojournalist ready to risk her life to photograph the Taliban. Five people from different worlds, their paths are destined to cross in a ruthless country devastated by war - Afghanistan. This is a thrilling story spanning 48 hours of five individuals linked by hate and fear, but brought together by fate to finally recognize each other. Set in post 9/11 war-torn Afghanistan, KABUL EXPRESS is a kidnap drama that is alternately funny and horrifying. Narrated in a light hearted manner, this is the story of a unique reluctant bond that develops between people who are otherwise ..."
41718,"https://m.media-amazon.com/images/M/MV5BMTk3NzM2ODg4Ml5BMl5BanBnXkFtZTcwODQ0MjA4MQ@@._V1_UX256,0,256,256_AL_.jpg",Johnny and the Bomb,2006,6.8,"adventure, comedy, drama",0,1,0,1,0,1,0,0,0,0,0,0,0,"    Based on the book by Terry Pratchett, the adventure begins for thirteen-year-old Johnny Maxwell and his four friends when they come to the aid of eccentric homeless woman, Mrs Tachyon, and are left minding her trolley full of black bags while she is hospitalised. When the children later visit her in hospital, Mrs Tachyon lets them into the secret that her black bags-- or 'Bags of Time-- are special and can be used to create a gateway to the past. The five youngsters end up during the Blitz where fun and games turn serious when they quickly realise the prejudices of the era. But when they return to their own time, the gang discover they have somehow changed history as a result Johnny's grandmother died in a bombing as a teenage girl meaning Johnny's mother and, in turn, himself were never born. The children are now in a race to fix the path in order to save the future but can they succeed before the bombs start falling...?"
41719,"https://m.media-amazon.com/images/M/MV5BYzExMjljM2QtOWVhMS00M2VmLWE5YzctODNlMGIyZmU4ODcwXkEyXkFqcGdeQXVyNjMwOTA1MDM@._V1_UX256,0,256,256_AL_.jpg",Pirates of the Caribbean: Dead Man's Chest,2006,6.8,"action, adventure, comedy",1,1,0,1,0,0,0,0,0,0,0,0,0,"    Once again we're plunged into the world of sword fights and ""savvy"" pirates. Captain Jack Sparrow is reminded he owes a debt to Davy Jones, who captains the flying Dutchman, a ghostly ship, with a crew from hell. Facing the ""locker"" Jack must find the heart of Davy Jones but to save himself he must get the help of quick-witted Will Turner and Elizabeth Swan. If that's not complicated enough, Will and Elizabeth are sentenced to hang, unless Will can get Lord Cutler Beckett Jack's compass. Will is forced to join another crazy adventure with Jack."
41720,"https://m.media-amazon.com/images/M/MV5BZmM1NzFhNjktYTRkZi00NjFjLTk2ZjktNzkyM2I5YjdmMTA0XkEyXkFqcGdeQXVyNjc3MjQzNTI@._V1_UX256,0,256,256_AL_.jpg",Bokura ga ita,2006,6.8,"animation, drama, romance",0,0,1,0,0,1,0,0,0,1,0,0,0,"    Nanami Takahashi is a high school student entering her first year. Immediately on her first day however, she becomes the victim of a practical joke by the school's most popular guy, Motoharu Yano, who coincidentally also ends up in her class. While the two get off to a rocky start, they soon find themselves falling in love with one another and begin dating. But their relationship is marred by Yano's past which includes the death of Yano's previous girlfriend, Nana Yamamoto, and the betrayal surrounding her death. To make matters more complicated her younger sister, Yuri, is in the same class as Yano and Nanami. As Yano struggles to come to grips with Nana's death and his unresolved feelings for her, so too must Nanami learn to understand Yano if the two hope to continue their relationship with one another."
41721,"https://m.media-amazon.com/images/M/MV5BNjg5NTQzNWUtMjAwNC00YWFkLWJmYTctNWM4NmI0N2U0YzQ4XkEyXkFqcGdeQXVyMTE2MTc3MzU1._V1_UX256,0,256,256_AL_.jpg",Dehati Babu,2006,6.8,"action, comedy, crime",1,0,0,1,1,0,0,0,0,0,0,0,0,"    Chhedhi returns to his village in Bihar and impresses everyone, including his simple and naive cousin, Mangru, with tales of his prosperity in Mumbai. After he returns, Ramdayal, Mangru's dad, enraged with his son for giving money away to the needy, asks him to join Chhedhi and prosper. Mangru accordingly re-locates and is shocked to find him living in Bharat Nagar's slum in Andheri and driving an auto-rickshaw. Suspecting a shortage of clothes, he then attempts to coerce young scantily clad women, including Urvashi, to wear traditional clothing, and is beaten by a mob. Then his life undergoes a major change when he must face off against an extortionist, Babubhai; and a manipulative builder, Subodh."
41722,"https://m.media-amazon.com/images/M/MV5BNmRhY2I4OTAtOTIyMS00NWZhLWE5ZmQtN2UwZjJjZWY5NzE3XkEyXkFqcGdeQXVyNjU0NTU1NjU@._V1_UX256,0,256,256_AL_.jpg",Ramen Fighter Miki,2006,6.8,"animation, action, comedy",1,0,1,1,0,0,0,0,0,0,0,0,0,"    In a world where terror grips the land and innocents have no solace from violence and brutality, one girl walks the line between life and death to bring her own special brand of - Ramen. Miki Onimaru works at her parent's Ramen shop, making deliveries, waiting tables, and attracting customers with cute, girlish charm. Somehow, Miki can't complete even one of these simple tasks without the full employment of her extensive bone-crunching, skull-splitting martial arts moves and penchant for unleashing relentless destruction. Can Miki get through the day without messing up and angering her Mom, who makes her look like a gentle kitten in comparison?"
41723,"https://m.media-amazon.com/images/M/MV5BMjAxNjcwOTIxNV5BMl5BanBnXkFtZTcwODIzMzQzMQ@@._V1_UX256,0,256,256_AL_.jpg",Machete,2006,6.8,"action, adventure, drama",1,1,0,0,0,1,0,0,0,0,0,0,0,"    Lucas Cano, (Machete) an ex-bodyguard for the Mexican President, tired of his life style, retires to a remote small town in Mexico, in hope of finding peace. But things do not work out for him the way he wants them to. First, he must confront several drug dealers who smuggle illegal immigrants into the United States, forcing them to smuggle drugs. Then, Machete finds out that his old Vietnam friend, who now works for the CIA in Arizona, has been assigned to arrest Machete, and take him back to the US for some old charges. Machete's health is deteriorating rapidly. He is constantly bleeding internally, but he won't stop drinking and smoking. Panchito is a little boy Machete met in a street fight, and the little boy, claiming not to have any family, decides to hang out with Machete and tries to help him change his life style. Machete does not know that a higher power is watching out for him. Panchito is an angel sent by God to save his body and soul. Esperanza (Pelancho) meets Machete ..."
41724,"https://m.media-amazon.com/images/M/MV5BMjE3MDg4MTkxMF5BMl5BanBnXkFtZTgwODk3MjI4MDE@._V1_UX256,0,256,256_AL_.jpg",As esi tu,2006,6.8,"adventure, romance",0,1,0,0,0,0,0,0,0,1,0,0,0,    A man trying to get away from it all finds both love and conflict in the woods in this offbeat drama from Lithuania.
41726,"https://m.media-amazon.com/images/M/MV5BZWU5ZjY2MTQtZDI5YS00ODAwLWI1YzctYzFkZTU3MzdmMGViXkEyXkFqcGdeQXVyMjg0MTI5NzQ@._V1_UX256,0,256,256_AL_.jpg",The Postmodern Life of My Aunt,2006,6.8,"comedy, drama, romance",0,0,0,1,0,1,0,0,0,1,0,0,0,"    Ye Rutang, a single-living woman in her late fifties, struggles to maintain a dignified life amid the dangers of Shanghai."
41727,"https://m.media-amazon.com/images/M/MV5BNWE2MzFmZjQtYzZlNC00OTRlLWFhMjQtOTg0MjYzZTdmN2ViXkEyXkFqcGdeQXVyMTkzODUwNzk@._V1_UX256,0,256,256_AL_.jpg",Snakes & Lizards,2006,6.8,"comedy, drama, mystery",0,0,0,1,0,1,0,0,1,0,0,0,0,"    A rascal, leery man assumes the place of a namesake honest young worker as the heir of a important businessman's wealth."
41729,"https://m.media-amazon.com/images/M/MV5BMDM2Nzg3YjAtMzFhMy00YTc2LWE0MWYtNjU5ZTgwODkwZDM2XkEyXkFqcGdeQXVyMzE4MDkyNTA@._V1_UX256,0,256,256_AL_.jpg",Joyong-han saesang,2006,6.8,"drama, mystery, thriller",0,0,0,0,0,1,0,0,1,0,0,0,1,"    Jung-Ho a famous photographer who has a special ability to read people's minds, has just returned to Korea from abroad. Jung-Ho still can't get rid of traumatic memories of his late girlfriend who ended her life in front of him. In the midst of this, Jung-Ho becomes a temporary guardian for Soo-Yeon a little girl whose mother is in a coma. Detective Kim begins to suspect Jung-Ho is involved in the gruesome events that surround him. And the case becomes even more desperate when Soo-Yeon herself disappears."
41730,"https://m.media-amazon.com/images/M/MV5BMTQ0MjU1ODQxMF5BMl5BanBnXkFtZTcwOTEzMjM1MQ@@._V1_UX256,0,256,256_AL_.jpg",In a Day,2006,6.8,"comedy, drama, romance",0,0,0,1,0,1,0,0,0,1,0,0,0,"    On the same morning that a creep throws coffee on her at a bus stop. Ashley runs into Michael, a man she recognizes as a regular at the sandwich shop where she works. He offers to help - dry her off, cheer her up, and after hesitation, she agrees to join him for a cup of tea. He offers to take her to lunch, asks her advice about a gift for his sister, and so on through the day, finding ways to treat her royally. By mid-afternoon he confesses that someone wants her to have the best possible day. Who is it, and why? And, when he does tell her, how will she respond?"
41731,"https://m.media-amazon.com/images/M/MV5BODJhY2EyODgtYjRlMC00NDAzLTg5N2MtZWZmMDE1YTQwODY2XkEyXkFqcGdeQXVyMTQxNzMzNDI@._V1_UX256,0,256,256_AL_.jpg",Old Joy,2006,6.8,drama,0,0,0,0,0,1,0,0,0,0,0,0,0,    Two old pals reunite for a camping trip in Oregon's Cascade Mountains.
41732,"https://m.media-amazon.com/images/M/MV5BYjM5OTU3YjctZGNjYy00ZTBlLTk0OGYtMmY1YjI1YTIwODgzXkEyXkFqcGdeQXVyNTM3MDMyMDQ@._V1_UX256,0,256,256_AL_.jpg",Mamotte! Lollipop,2006,6.8,animation,0,0,1,0,0,0,0,0,0,0,0,0,0,"    A normal, average teen girl accidently swallows something called a ""crystal pearl,"" which many sorcerers are after! As she is in danger, 2 boys come down and vow to protect her. She is no longer an ordinary girl!"
41733,"https://m.media-amazon.com/images/M/MV5BODI3ZGU5OGQtOTA2My00NGMxLTkxM2UtNDFhOWE5MDQyM2VhXkEyXkFqcGdeQXVyMjcyNzc1NTg@._V1_UX256,0,256,256_AL_.jpg",Lost Planet: Extreme Condition,2006,6.8,"action, adventure, drama",1,1,0,0,0,1,0,0,0,0,0,0,0,"    Wayne Holden, a soldier, attempts to overthrow NEVEC, who still vie for control over E.D.N. III, and help colonization efforts for the remainder of the human race by destroying the Akrid."
41734,"https://m.media-amazon.com/images/M/MV5BYzQ3OTliNzItNmQ4MC00MWRjLWFmMGEtODMyZTM0NTc1NjMxXkEyXkFqcGdeQXVyNjcwNDU1NDM@._V1_UX256,0,256,256_AL_.jpg",Zombie Prom,2006,6.8,"short, comedy, horror",0,0,0,1,0,0,0,1,0,0,0,1,0,    A teenage romance between a good girl and a bad boy spirals out of control leaving a trail of nuclear waste.
41735,"https://m.media-amazon.com/images/M/MV5BMTk4MDQwOTIzMl5BMl5BanBnXkFtZTcwNDY4OTI1Mg@@._V1_UX256,0,256,256_AL_.jpg",Hookers in Revolt,2006,6.8,"crime, thriller",0,0,0,0,1,0,0,0,0,0,0,0,1,"    Hookers In Revolt (2006) - Tired of mistreatment from the hands of their pimps, a group of hookers ban together to start their own escort agency under the credo, ""all women are equal to men"". But as the money quickly comes in, the hoes in charge become corrupt from their newfound power and the hookers soon learn that, ""all women are equal to men, however some are more equal than others""... Hookers In Revolt. These hoes mean business!"
41736,"https://m.media-amazon.com/images/M/MV5BNWYwYzZmOWMtNGRmYy00ZDRlLWJhNDAtYjIzNzg2ZTgyMzJiXkEyXkFqcGdeQXVyMjc4OTQ1OTA@._V1_UX256,0,256,256_AL_.jpg",Looking Up at the Half-Moon,2006,6.8,"animation, comedy, drama",0,0,1,1,0,1,0,0,0,0,0,0,0,"    Yuichi Ezaki and Rika Akiba are two 17-year-old teenagers hospitalized for different conditions. Yuichi suffers from hepatitis A, while Rika suffers from a weak heart and has been hospitalized for most of her life. Yuichi first notices Rika and attempts to befriend her. As the two patients spend more time together they soon start to fall in love."
41737,"https://m.media-amazon.com/images/M/MV5BNmY3YjNiMTctZWRiNy00NjQ2LWI1NzctMThhOTRiZGZhZDQyXkEyXkFqcGdeQXVyOTk3NTc2MzE@._V1_UX256,0,256,256_AL_.jpg",Something Something... Unnakum Ennakum,2006,6.8,romance,0,0,0,0,0,0,0,0,0,1,0,0,0,    Santosh is a Non Resident Indian who goes to India to a wedding. He meets Kavitha. They fall in love. But Santosh's mother doesn't approve neither does Kavitha's brother who asks him to work as a labourer in his farm as a test. Santosh tries to win the brother's heart and Kavitha's hand.
41738,"https://m.media-amazon.com/images/M/MV5BY2ZhOGE4MDktZGVkZS00ZWNmLWFjYTctODYzNzcxMDlmYmQ1XkEyXkFqcGdeQXVyMzczOTU3OQ@@._V1_UX256,0,256,256_AL_.jpg",BlackJack: At the Gates,2006,6.8,"crime, drama, mystery",0,0,0,0,1,1,0,0,1,0,0,0,0,"    A baby was killed in a house arson fire 10 years ago after a violent home invasion. The parents used the tragedy as a motivation to help build an evangelical community church but now the mother has comes to Jack for help. Jack agrees to look into the still unsolved crime but in looking for the truth Jack will have to fight the system and his own conscience to uncover a tangled web of lies and deception. In the end, Jack must decide if the truth should prevail over the interests of the innocent."
41739,"https://m.media-amazon.com/images/M/MV5BODRiMDgzNDItMDI5Zi00NGFhLWJlZjktZmJlNmRhNTFkYTgyXkEyXkFqcGdeQXVyMTgxOTIzNzk@._V1_UX256,0,256,256_AL_.jpg",Tough Love,2006,6.8,"drama, romance",0,0,0,0,0,1,0,0,0,1,0,0,0,    A father takes his son on a fishing trip to try and explain why he was so mean and tough on him.
41740,"https://m.media-amazon.com/images/M/MV5BOTM1YjU4ODktNTM5ZS00Nzg1LTlkNmMtMjQ1NzU2MTkzOTlhXkEyXkFqcGdeQXVyNDkwMzY5NjQ@._V1_UX256,0,256,256_AL_.jpg",'Wag kang lilingon,2006,6.8,horror,0,0,0,0,0,0,0,1,0,0,0,0,0,"    ""Wag Kang Lilingon is a twin-bill horror movie In the first story ""Uyayi,"" Anne plays Melissa, a young nurse with a bright future ahead of her. But will the future turn to her favor as strange and violent events occur at the hospital she works for. Together with her boyfriend James, they try to uncover the killer behind the rising number of deaths among the patients in the hospital. But will she be one of the victims? Quark Henares megs the episode. In the second story ""Salamin,"" Kristine plays Angel, a beautiful young family breadwinner whose only aspiration is to see her family live a better life. When her father left her and her mother and younger sister for another woman, Angel decided to move into a new place. Little did they know the danger that lies ahead. As she discovers an old mirror, she makes a wish at the stroke of midnight by the candlelight-to know her future. Instead she unwittingly opens a portal of spirits! What will be the repercussions of her actions? Jerry ..."
41741,"https://m.media-amazon.com/images/M/MV5BMTYzMjg2MTM1NF5BMl5BanBnXkFtZTcwNTk4MDg5MQ@@._V1_UX256,0,256,256_AL_.jpg",Fascisti su Marte,2006,6.8,"comedy, sci-fi",0,0,0,1,0,0,0,0,0,0,1,0,0,"    A handful of Blackshirts commanded by Hierarch Barbagli arrives on Mars.The planet is hostile and scarce water and food. After great discoveries, hilarious adventures and mystical visions, will the fascists be able to go back home?"
41742,"https://m.media-amazon.com/images/M/MV5BNTk0ODI2NDQ5N15BMl5BanBnXkFtZTgwNzYxMjY4NjE@._V1_UX256,0,256,256_AL_.jpg",It Doesn't Hurt Me,2006,6.8,"drama, romance",0,0,0,0,0,1,0,0,0,1,0,0,0,"    Three young friends have all they need for a sterling life besides money. The pursuit of them leads guys to Natella Antonovna. She'll show them luxury life. Unless, one surprise is going to turn up..."
41743,"https://m.media-amazon.com/images/M/MV5BNmQ3ZDBlMWItZDFkNS00Y2NjLWFmMDYtYTBmMTJjYWVjNzVhXkEyXkFqcGdeQXVyODQ1NTk5OQ@@._V1_UX256,0,256,256_AL_.jpg",The Game,2006,6.7,"comedy, drama, romance",0,0,0,1,0,1,0,0,0,1,0,0,0,    A spinoff of Girlfriends (2000) featuring a group of women who all have relationships with professional football players.
41744,"https://m.media-amazon.com/images/M/MV5BMTI3NzQwNDEyN15BMl5BanBnXkFtZTcwMDY4ODQ0MQ@@._V1_UX256,0,256,256_AL_.jpg",Smokin' Aces,2006,6.7,"action, comedy, crime",1,0,0,1,1,0,0,0,0,0,0,0,0,"    Mob boss Primo Sparazza has taken out a hefty contract on Buddy ""Aces"" Israel, a sleazy magician who has agreed to turn state's evidence against the Vegas mob. The FBI, sensing a chance to use this small-time con to bring down big-target Sparazza, places Aces into protective custody-under the supervision of two agents dispatched to Aces' Lake Tahoe hideout. When the word of the price on Aces' head spreads into the community of ex-cons and cons-to-be, it entices bounty hunters, thugs-for-hire, deadly vixens and double-crossing mobsters to join in the hunt. With all eyes on Tahoe, this rogues' gallery collides in a comic race to hit the jackpot and rub out Aces."
41745,"https://m.media-amazon.com/images/M/MV5BMTQwMTQxNTcwOF5BMl5BanBnXkFtZTcwMzQ1NzUzMQ@@._V1_UX256,0,256,256_AL_.jpg",Over the Hedge,2006,6.7,"animation, adventure, comedy",0,1,1,1,0,0,0,0,0,0,0,0,0,"    RJ, a raccoon who needs food, accidentally takes food from a hungry bear named Vincent and he wants his food to be found in exactly the same place in a week. He finally finds that an animal family, with a tortoise named Verne as their leader, could help him restore the food from the suburbia, the gateway to the good life. But little does RJ know, there is a woman who has recently hired an exterminator to try to hunt them down."
41746,"https://m.media-amazon.com/images/M/MV5BNDBhNDJiMWEtOTg4Yi00NTYzLWEzOGMtMjNmNjAxNTBlMzY3XkEyXkFqcGdeQXVyNTIzOTk5ODM@._V1_UX256,0,256,256_AL_.jpg",X-Men: The Last Stand,2006,6.7,"action, adventure, sci-fi",1,1,0,0,0,0,0,0,0,0,1,0,0,"    When a ""cure"" is created, which apparently can turn any mutant into a ""normal"" human being, there is outrage amongst the mutant community. While some mutants do like the idea of a ""cure"", including Rogue, many mutants find that there shouldn't be a ""cure"". Magneto, who still believes a war is coming, recruits a large team of mutants to take down Warren Worthington II and his ""cure"". Might seem easy for the X-Men to stop, but Magneto has a big advantage, which Wolverine doesn't have. Jean Grey has returned, and joined with Magneto. The Dark Phoenix has woken within her, which has the ability to destroy anything in her way, even if that ""anything"" is an X-Man."
41747,"https://m.media-amazon.com/images/M/MV5BMjEzNDY1OTQwOV5BMl5BanBnXkFtZTcwNjcxMTIzMw@@._V1_UX256,0,256,256_AL_.jpg",Underworld: Evolution,2006,6.7,"action, fantasy, thriller",1,0,0,0,0,0,1,0,0,0,0,0,1,"    As the war between the vampires and the Lycans rages on, the beautiful vampire, Selene, a former member of the Death Dealers, and Michael, the werewolf hybrid, work together in an effort to unlock the secrets of their respective bloodlines. In this ancient feud between the two tribes, they try to unlock the secrets, in a modern tale of action, intrigue, and forbidden love, which takes them into the battle to end all wars, as the immortals must finally face their doom."
