id,poster,title,year,rating,genre,action,adventure,animation,comedy,crime,drama,fantasy,horror,mystery,romance,sci-fi,short,thriller,plot
41862,"https://m.media-amazon.com/images/M/MV5BODIxNzYxNDEzNl5BMl5BanBnXkFtZTgwMjA1NTM2MTI@._V1_UX256,0,256,256_AL_.jpg",Curious George,2006,6.5,"animation, adventure, comedy",0,1,1,1,0,0,0,0,0,0,0,0,0,"    The man with the yellow hat named Ted Shackleford works at a natural history museum that's fallen on hard times. The museum director's son wants to turn it into a parking lot, but Ted offers to bring back a mysterious idol from Africa that's guaranteed to pull in crowds. Unfortunately, the idol turns out to be three inches tall. But Ted accidentally brings back a lonely yet irrepressible monkey, soon dubbed ""George"". They set off on a non-stop action, fun-filled journey through the wonders of the big city toward the warmth of true friendship."
41863,"https://m.media-amazon.com/images/M/MV5BMTY5MjY1NTQ5NF5BMl5BanBnXkFtZTcwNDY1MTM5MQ@@._V1_UX256,0,256,256_AL_.jpg",'Til Death,2006,6.5,"comedy, romance",0,0,0,1,0,0,0,0,0,1,0,0,0,    A pair of newlyweds move in next door to a veteran married couple of 25 years.
41864,"https://m.media-amazon.com/images/M/MV5BMzY4ZjcxOTItNWQwOC00MmMxLTkzMjYtZmQwMTJiMGY5Y2JlXkEyXkFqcGdeQXVyMTAwMzUyOTc@._V1_UX256,0,256,256_AL_.jpg",Last Holiday,2006,6.5,"comedy, romance",0,0,0,1,0,0,0,0,0,1,0,0,0,"    In morte veritas. Georgia Byrd clerks at a New Orleans department store. She defers pleasure: cooks gourmet meals, eats Lean Cuisine; likes a co-worker in silence; has savings, but hasn't left Louisiana. All that changes when a CT Scan discloses she has three weeks to live. She cashes her savings and heads to Grandhotel Pupp in the Czech Republic, where Chef Didier presides. She checks into the Presidential Suite, orders everything on the menu, snowboards, and comes to the attention of the chef and the hotel's powerful American guests: a Congressman, a Senator, a retail magnate, and his mistress. She has nothing to lose, so she tells them what she thinks. Will the truth set them free?"
41865,"https://m.media-amazon.com/images/M/MV5BMDJjNDUwYjMtZDg2OS00OThlLTg1YjQtMWVjNDJmMTBhODIzXkEyXkFqcGdeQXVyNjc5Mjg4Nzc@._V1_UX256,0,256,256_AL_.jpg",My Wife Is a Gangster 3,2006,6.5,"action, comedy, drama",1,0,0,1,0,1,0,0,0,0,0,0,0,"    When Aryong, the daughter of a triad boss from Hong Kong is accused of killing the boss of a competing triad, she is goes into hiding in Korea. Upon arriving, she is guided by a nimble but loyal Gi-chul and his motley crew, who are assigned to protect her until her return."
41866,"https://m.media-amazon.com/images/M/MV5BYjVlZDI3ZDYtMzBjYy00N2U3LTg5ODQtZDNjNjMwY2Q3YTEwXkEyXkFqcGdeQXVyNjg3MTIwODI@._V1_UX256,0,256,256_AL_.jpg",Day Watch,2006,6.5,"action, fantasy, horror",1,0,0,0,0,0,1,1,0,0,0,0,0,"    Anton belongs to the Forces of the Light as do his powerful girlfriend and apprentice, but his son is a powerful teenager from the Darkness and Anton protects him. When the balance between Light and Darkness is affected by the death of some evil vampires, Anton is framed and accused of the murders, and he chases an ancient chalk that has the power of changing the destiny of its owner."
41867,"https://m.media-amazon.com/images/M/MV5BN2FkZjM2ZTUtMGNlYy00MTQwLWIyNDktN2Q0MzNiYzEwMDA1XkEyXkFqcGdeQXVyMTQxNzMzNDI@._V1_UX256,0,256,256_AL_.jpg",Severance,2006,6.5,"comedy, horror, thriller",0,0,0,1,0,0,0,1,0,0,0,0,1,    A team-building weekend in the mountains of Eastern Europe goes horribly wrong for the sales division of the multi-national weapons company Palisade Defence when they become the victims of a group of crazed killers who will stop at nothing to see them dead.
41868,"https://m.media-amazon.com/images/M/MV5BMTUyODU2NjM0Ml5BMl5BanBnXkFtZTcwMTUzMTA0MQ@@._V1_UX256,0,256,256_AL_.jpg",Unknown,2006,6.5,"crime, drama, mystery",0,0,0,0,1,1,0,0,1,0,0,0,0,    Five men wake up in a locked-down warehouse with no memory of who they are. They are forced to figure out who is good and who is bad to stay alive.
41869,"https://m.media-amazon.com/images/M/MV5BM2MxNzVkOTItZjE2Yy00MmNkLTg0ZmUtM2U0YTlmYWQxMDRkXkEyXkFqcGdeQXVyNTM3MDMyMDQ@._V1_UX256,0,256,256_AL_.jpg",Hellboy Animated: Sword of Storms,2006,6.5,"animation, action, adventure",1,1,1,0,0,0,0,0,0,0,0,0,0,"    A folklore professor becomes unwittingly possessed by the ancient Japanese demons of Thunder and Lightning. But when The Bureau of Paranormal Research & Defense dispatches a team of agents to investigate, a cursed samurai sword sends Hellboy to a supernatural dimension of ghosts, monsters, and feudal mayhem. Now while pyrokinetic Liz Sherman and fishboy Abe Sapien battle one very pissed-off dragon, a lost and cranky Hellboy must find his way home."
41870,"https://m.media-amazon.com/images/M/MV5BMTY3MjMxNzYxOV5BMl5BanBnXkFtZTgwNDU4NjAwNzE@._V1_UX256,0,256,256_AL_.jpg",Tom and Jerry in Shiver Me Whiskers,2006,6.5,"animation, action, adventure",1,1,1,0,0,0,0,0,0,0,0,0,0,    A cat and a mouse must outsmart a band of pirates to find buried treasure.
41871,"https://m.media-amazon.com/images/M/MV5BMjliODdkOGEtYTcxMi00Mzg3LWEyNDQtMDkwZTlmMGI5YjM2XkEyXkFqcGdeQXVyMzM4NjcxOTc@._V1_UX256,0,256,256_AL_.jpg",Kappa Mikey,2006,6.5,"animation, adventure, comedy",0,1,1,1,0,0,0,0,0,0,0,0,0,    Self-Absored Mikey Simon travels from America to Tokyo to after failing as an actor he is signed to become a cheap parody cliche of anime shows and wreak havoc amongst his new friends without ever truly learning from punishments but tries his version of his best.
41872,"https://m.media-amazon.com/images/M/MV5BODlmYmZlZTEtZDUyMC00YTg0LTkyYWMtMDdkZmM0NDZmMWE3XkEyXkFqcGdeQXVyMTQ4NDY5OTc@._V1_UX256,0,256,256_AL_.jpg",Delirious,2006,6.5,"comedy, drama, romance",0,0,0,1,0,1,0,0,0,1,0,0,0,"    Les, a small-time celebrity photographer desperate to make it big, befriends Toby, a homeless young man with no direction except a vague desire to become an actor. When by chance Toby becomes romantically involved with K'Harma Leeds, the hottest pop star of the moment, Les grows jealous and plots revenge."
41873,"https://m.media-amazon.com/images/M/MV5BNTAyYmYxOTktNjNmZS00ZTZlLWI2YjUtM2RlZTlkM2ZiZjdhXkEyXkFqcGdeQXVyNTkzNDQ4ODc@._V1_UX256,0,256,256_AL_.jpg",Dhoom 2,2006,6.5,"action, thriller",1,0,0,0,0,0,0,0,0,0,0,0,1,"    The world's oldest desert, the Namib - A solitary railway line - A royal family on a royal journey. From the sky - like lightening - A flash - the centuries old royal crown is stolen. Back in action - DHOOM:2 reinvents the action comedy genre and propels it into the 21st century. Ali's (Uday Chopra) dream of becoming a police officer has come true. He is now ACP Jai Dixit's (Abhishek Bachchan) right hand man. Together they are trying to keep a tight leash on the crime in India, little do they know what they are going to be up against. Enter Aryan - Mr.A (Hrithik Roshan) A high tech international thief after pulling off a series of impossible heists all over the world. His next target is Mumbai, India. The case is given to ACP Jai Dixit and Ali helping them put the pieces of the puzzle together is ACP Shonali Bose (Bipasha Basu). For the last two years Shonali has been tracking these amazing thefts and is now an expert on this thief, who no one has seen. Once in Mumbai Mr.A finds his ..."
41874,"https://m.media-amazon.com/images/M/MV5BMTI3NzM3NDU4M15BMl5BanBnXkFtZTcwNjYzODgzMQ@@._V1_UX256,0,256,256_AL_.jpg",Breaking and Entering,2006,6.5,"crime, drama, romance",0,0,0,0,1,1,0,0,0,1,0,0,0,"    A mother and her daughter, a mother and her son, and a man living with one and attracted to the other. Miro, a teen from Sarajevo, lives near King's Cross with his mother; he's nimble, able to run across roofs, so his uncle hires him to break into office skylights, so the uncle can boost computers. Twice they steal from Will's architectural firm, so Will stakes it out at night. He follows Miro home and returns the next day and meets Miro's mother, Amira. At home, Will's relationship with Liv is strained - he feels outside Liv and her daughter Bea's circle. The stakeout and Amira's vulnerability are attractive alternatives to being at home. The police, too, watch Miro."
41875,"https://m.media-amazon.com/images/M/MV5BZmQ2MGE5NmEtYWM1OS00ZDc3LWJlNTMtNGU3YTQ1NDVlNDdiXkEyXkFqcGdeQXVyODU2MDg1NzU@._V1_UX256,0,256,256_AL_.jpg",Origin: Spirits of the Past,2006,6.5,"animation, adventure, drama",0,1,1,0,0,1,0,0,0,0,0,0,0,"    It is 300 years into the future. Earth's environment had been devastated by mankind's own foolish plans and humankind is beleaguered by the sentient forests which they have awoken. The world balance is tipped when a young boy named Agito stumbles across a machine that glowed in a strange blue hue inside a forbidden sanctuary. The machine, which has preserved a beautiful girl named Tula from the past, is activated. Tula has a ""mission"" that had been entrusted to her by the past ..."
41876,"https://m.media-amazon.com/images/M/MV5BMjA5MjA4MzM2Ml5BMl5BanBnXkFtZTcwMTU1OTc1MQ@@._V1_UX256,0,256,256_AL_.jpg",Amazing Extraordinary Friends,2006,6.5,"action, adventure, comedy",1,1,0,1,0,0,0,0,0,0,0,0,0,"    A dorky teenage boy finds an amulet, that turns him into a real life superhero, with powers. Where there are superheroes there are always super villains but with the help of his friends they don their masks to fight for justice. Being a superhero is every boy's dream but when you have to balance battling evil by night and attending school by day there's not enough time left for homework, or chores. Will he graduate high school, will he be able to save the world, will his arch nemises finally defeat him, does the amulet hold untapped powers, can he find a girlfriend, can they really all stay friends? Travel on Amazing Extraordinary adventures with the Amazing Extraordinary Friends!"
41877,"https://m.media-amazon.com/images/M/MV5BMTU3YTcwNTMtNDA3NC00ZGNhLTg0OTItNGJjMDg0ZDJhZDBjXkEyXkFqcGdeQXVyNjYwMzk3NDM@._V1_UX256,0,256,256_AL_.jpg",Over the Hedge,2006,6.5,"animation, action, adventure",1,1,1,0,0,0,0,0,0,0,0,0,0,"    RJ, a raccoon who needs food, accidentally takes food from a hungry bear named Vincent and he wants his food to be found in exactly the same place in a week. He finally finds that an animal family, with a tortoise named Verne as their leader, could help him restore the food from the suburbia, the gateway to the good life. But little does RJ know, there is a woman who has recently hired an exterminator to try to hunt them down."
41878,"https://m.media-amazon.com/images/M/MV5BNjk2ZWIzOTYtMGUxMC00MzdhLWI3ZGMtZGJhNzZmMDYxYjJlXkEyXkFqcGdeQXVyMjQ3NTQ4MjQ@._V1_UX256,0,256,256_AL_.jpg",Naruto the Movie 3: Guardians of the Crescent Moon Kingdom,2006,6.5,"animation, action, adventure",1,1,1,0,0,0,0,0,0,0,0,0,0,"    Naruto, Kakashi, Sakura, and Rock Lee are assigned to protect Michiru, the prince of the Land of the Moon, while he travel the world. The prince purchased a tiger Sham and the whole circus, which became the team's protection."
41879,"https://m.media-amazon.com/images/M/MV5BNTc1NDkwNDg4M15BMl5BanBnXkFtZTgwNTg1OTkwMzE@._V1_UX256,0,256,256_AL_.jpg",Ira & Abby,2006,6.5,"comedy, romance",0,0,0,1,0,0,0,0,0,1,0,0,0,"    A hastily married couple quickly devolve into a life of affairs, meddling parents, and therapy."
41880,"https://m.media-amazon.com/images/M/MV5BYzhjZjk3NjYtNzNjOC00YThhLTgyZDMtMzZmNjZhYmQ4NDcwXkEyXkFqcGdeQXVyNzg5OTk2OA@@._V1_UX256,0,256,256_AL_.jpg",Chicken Little: Ace in Action,2006,6.5,"action, adventure, comedy",1,1,0,1,0,0,0,0,0,0,0,0,0,    A sixth-generation Chicken Little video game follows the plot of the 2005 movie and children's books.
41881,"https://m.media-amazon.com/images/M/MV5BMTQxNTMxODM4Nl5BMl5BanBnXkFtZTgwNjMwMDAxMzE@._V1_UX256,0,256,256_AL_.jpg",Ghostboat,2006,6.5,"drama, mystery, thriller",0,0,0,0,0,1,0,0,1,0,0,0,1,"    A British Sub goes missing at the end of WWII, leaving only one survivor. Everyone believes it lost to the bottom of the Baltic Sea, then 40 years later it reappears without a crew. The British government sends for the one surviving crew member (David Jason), who is now a marine biologist. With a new crew, Jason proceeds to trace the last known happenings on the sub. But this submarine has a life of its own and the new crew soon start showing characteristics of the old crew."
41882,"https://m.media-amazon.com/images/M/MV5BMTI0MDkzODY4Ml5BMl5BanBnXkFtZTcwNTM2NTA0MQ@@._V1_UX256,0,256,256_AL_.jpg",Robotech: The Shadow Chronicles,2006,6.5,"animation, action, adventure",1,1,1,0,0,0,0,0,0,0,0,0,0,"    The Robotech Expeditionary Force stages their final assault on the Invid to liberate Earth at all costs along with REF pilot Scott Bernard and the Invid princess Ariel's parallel planetside efforts at the alien's stronghold, Reflex Point. Just before the attack, the fleet gets a distress call from Admiral Rick Hunter and their flagship, SDF-3. In the ensuing mission, which only manages to rescue the android Janice Em, the REF discover that they have been betrayed by their own ally, the Haydenites, whose powerful technology they have supplied now is revealed to be designed to devastatingly enable their own plans of conquest even as the Invid withdraw. As Scott and Ariel join the fleet, the disparate pair and Janice must overcome their comrade's deep distrust to find a means to stop their newest foe before it is too late."
41883,"https://m.media-amazon.com/images/M/MV5BMjAzNGRlZDEtYzNjZS00NDc2LThhYWQtYWY1NWY1NDU2OTg3XkEyXkFqcGdeQXVyMjc4OTQ1OTA@._V1_UX256,0,256,256_AL_.jpg",Coyote Ragtime Show,2006,6.5,"animation, action, adventure",1,1,1,0,0,0,0,0,0,0,0,0,0,"    In an alternate galaxy, there's an outlaw named Mister who's 10 days from his prison release. He escapes from prison with the help of his comrades Bishop and Katana. As they seek out to find Franka, who's been left under Mister's care by her dead father. On a journey to find Franka's father's treasure. Throughout the series, Mister is being tracked down by 2 federal investigators: Angelica and Chelsea . And Madame Marciano's Twelve Sisters, an android assassins of the Criminal Guild."
41884,"https://m.media-amazon.com/images/M/MV5BZjljMjE3MmUtZmE0ZS00MjQ0LTlkNjQtZmJjNjRjZDczOTVlXkEyXkFqcGdeQXVyMzM4MjM0Nzg@._V1_UX256,0,256,256_AL_.jpg",Last Exit,2006,6.5,"action, drama, thriller",1,0,0,0,0,1,0,0,0,0,0,0,1,"    Shattered windshields. Twisted wreckage. Last Exit is an action-suspense drama that tells the parallel stories of two ordinary women - one, a single mother barely supporting her handicapped son, and the other, a working mom precariously balancing her family with a high-pressure career - on one extraordinary day. Each woman's life frays under the weight of her circumstances and spirals out of control. As police officers race to save them, pieces of a shattered puzzle fall into place - maybe this wasn't just a tragic car accident after all. Both women fight for their lives, but ultimately, only one will survive"
41885,"https://m.media-amazon.com/images/M/MV5BNDVlMDJmMWItMjc4My00YWUwLTkyOTgtNTQxZWFkMjRhODlhXkEyXkFqcGdeQXVyNTY2MDkzMzA@._V1_UX256,0,256,256_AL_.jpg",Rat-Man,2006,6.5,"animation, comedy",0,0,1,1,0,0,0,0,0,0,0,0,0,"    A lazy and silly superhero fights crime in the ""city without name"" with his hilarious and mindless ways."
41886,"https://m.media-amazon.com/images/M/MV5BNjRjZGRlZDgtZGNlMC00OWVmLTkwNjktOWMwNTAyYTk0YTU4XkEyXkFqcGdeQXVyMDk2Mzc2MA@@._V1_UX256,0,256,256_AL_.jpg",Longing,2006,6.5,"drama, romance",0,0,0,0,0,1,0,0,0,1,0,0,0,"    A metalworker and volunteer firefighter, who is content with his marriage to his childhood sweetheart, sees his life turn upside down when he falls in love with an attractive waitress from a nearby town."
41887,"https://m.media-amazon.com/images/M/MV5BZjRjMGU5ODItOTBlNi00NzQ2LWEyNzQtOTFlOGMxMjA0ZDliXkEyXkFqcGdeQXVyNzkyNTc1NzM@._V1_UX256,0,256,256_AL_.jpg",Tokko,2006,6.5,"animation, action, crime",1,0,1,0,1,0,0,0,0,0,0,0,0,"    When 108 demons free themselves and start killing people, Special Public Safety Task Force, or ""Tokko"" for short, is formed to stop them. Some of the members have demons inside of them and can use them to enhance their own abilities."
41888,"https://m.media-amazon.com/images/M/MV5BMjA0ODA1NjI1MV5BMl5BanBnXkFtZTgwNTkwMTA2MDE@._V1_UX256,0,256,256_AL_.jpg",Cheongchun-manhwa,2006,6.5,"comedy, romance",0,0,0,1,0,0,0,0,0,1,0,0,0,"    Ji-hwan is a taekwondo student with a part time job as a stunt man, who dreams of becoming Korea's answer to Jackie Chan. Dal-rae is a drama student and aspiring actress, but tends to fail auditions because of her timid personality."
41889,"https://m.media-amazon.com/images/M/MV5BMTg4Y2ZmNTEtNzIyZC00NmJmLWI0ZjUtMGMwZTQ0MDRkYmZlXkEyXkFqcGdeQXVyMTMxMTY0OTQ@._V1_UX256,0,256,256_AL_.jpg",The Serpent,2006,6.5,thriller,0,0,0,0,0,0,0,0,0,0,0,0,1,"    A ruthless gang led by private detective Joseph Plender is extorting rich people and famous fashion photographer Vincent Mandel seems the next victim. He is married to Hélène, daughter of one of the richest people in Europe, but not quite happily. In fact the marriage is on the brink of a divorce and a judge is deciding who will take the two children. Can Hélène take them to Germany or will they stay with Vincent? Vincent has a lot on his mind and he improvises when model Sofia Kippiani comes to his studio, but his makeup crew doesn't show up. Before he knows it, he is accused of a rape. Things go worse and worse for Vincent, he sees his entire life slipping away and, most importantly, he might lose his children. But why does his former schoolmate Joseph Plender seek contact with Vincent and even solve a nasty problem for him? Does Plender want something more than money?"
41890,"https://m.media-amazon.com/images/M/MV5BMTMzODU2MjEyNV5BMl5BanBnXkFtZTcwMjU1MTM1MQ@@._V1_UX256,0,256,256_AL_.jpg",Dans Paris,2006,6.5,"drama, romance",0,0,0,0,0,1,0,0,0,1,0,0,0,"    After a love affair ends badly, a young Parisian named Paul (Romain Duris) sinks into the same kind of deep depression that led his sister to kill herself. He moves back home with his father (Guy Marchand) and aimless brother Jonathan (Louis Garrel) but refuses to get out of bed. One night, Paul rises from his torpor and makes a fateful visit to the Seine."
41891,"https://m.media-amazon.com/images/M/MV5BMzUzNDE0MTA5NF5BMl5BanBnXkFtZTcwNDMxMDY2OQ@@._V1_UX256,0,256,256_AL_.jpg",Fashion House,2006,6.5,"drama, romance",0,0,0,0,0,1,0,0,0,1,0,0,0,"    Set in the world of the cutthroat fashion industry, a ruthless mogul (Derek) defends her company against a hostile takeover."
41893,"https://m.media-amazon.com/images/M/MV5BM2IwMDIzMzktN2Q2My00OWE5LTg2YTAtMTEzOTk1MjUyNTIyXkEyXkFqcGdeQXVyMjg0MTI5NzQ@._V1_UX256,0,256,256_AL_.jpg",Confession of Pain,2006,6.5,"crime, drama, thriller",0,0,0,0,1,1,0,0,0,0,0,0,1,"    When veteran detective Hei finds out that his father-in-law, the billionaire benefactor Kim, is gruesomely murdered in his palatial mansion, he enlists the assistance of his former partner turned private detective, Bong. On the surface, the murder smacks of a vendetta that has taken a lifetime to fulfill. But no sooner has Bong agreed to crack the case with Hei than he realizes nothing is what it appears to be. Undoubtedly, they are after a monster in a perfect crime: every detail was meticulously orchestrated, every motive conveniently justifiable, and every culprit and potential witness mysteriously eliminated. But Bong has his own demon to fight over the suicide of his pregnant girlfriend. As he digs deeper and deeper into the case, he starts grappling with the suspicion that the man they hunt is someone very close to them, someone on the verge of a total breakdown."
41894,"https://m.media-amazon.com/images/M/MV5BYjFhMmM3ZmEtZmY4Mi00NjkyLWFjN2QtNTIwZDM3NDEyNGIxXkEyXkFqcGdeQXVyNTA1NjU1ODM@._V1_UX256,0,256,256_AL_.jpg",Kaybolan yillar,2006,6.5,"action, crime, drama",1,0,0,0,1,1,0,0,0,0,0,0,0,"    It started with a woman called Rosa, who gave birth to a little baby girl but her family was against her raising the baby all alone with no father so they took the baby from her and gave her to a woman called Julia. julia took the little girl and put her in front of some orphanage with the necklace of her mother around her neck and left. A 6 years old little boy called Esmer was watching what was happening from the orphanage window, he awakened his best friend Ali to go and see the little baby. When Esmer carried the little girl in his arms he kissed her on her cheek and said "" I found you, so from now on you belong to me"" . Seven years later , the little girl grows up to be the young and the beautiful Ezel. Esmer, Ali and Ezel become best friends,inseparable. But a family comes in to adopt Ezel, as a replacement for their dead daughter , the three lives of these 3 children will change forever as they will be separated and then will meet again after 23 years and they won't even know ..."
41895,"https://m.media-amazon.com/images/M/MV5BZGVlY2JlOGEtODgwNy00MjZhLTk4YzAtNzAwOTg4ZTdkOTYzXkEyXkFqcGdeQXVyNjQwMjk2MTc@._V1_UX256,0,256,256_AL_.jpg",Ranam,2006,6.5,action,1,0,0,0,0,0,0,0,0,0,0,0,0,    The duel between hero and villain when hero falls for villains sister
41896,"https://m.media-amazon.com/images/M/MV5BNTg1MDQ2YTEtOTcxMy00OTVmLTk4ZGQtYzAzZTFlZmQ2ZjhmXkEyXkFqcGdeQXVyMjQwMjk0NjI@._V1_UX256,0,256,256_AL_.jpg",Fatal Contact,2006,6.5,"action, crime, thriller",1,0,0,0,1,0,0,0,0,0,0,0,1,"    A young man learns the fighting techniques of Sanda from a coach. The two become best friends as the young man prepares to enter an underground tournament, competing against some of the top fighters of the world."
41897,"https://m.media-amazon.com/images/M/MV5BMTU5ODAyMTAxNl5BMl5BanBnXkFtZTcwNDk3OTQzMQ@@._V1_UX256,0,256,256_AL_.jpg",Land of the Blind,2006,6.5,"drama, thriller",0,0,0,0,0,1,0,0,0,0,0,0,1,"    A political drama about terrorism, revolution, and the power of memory. In an unnamed place and time, an idealistic soldier named Joe strikes up an illicit friendship with a political prisoner named Thorne, who eventually recruits him into a bloody coup d'etat. But in the post-revolutionary world, what Thorne asks of Joe leads the two men into bitter conflict, spiraling downward into madness until Joe's co-conspirators conclude that they must erase him from history."
41898,"https://m.media-amazon.com/images/M/MV5BOGIxMjNhYWQtYzYwZC00MDE4LTk3MTMtNjdlNDYwYTRkZmFmXkEyXkFqcGdeQXVyNjA3OTI5MjA@._V1_UX256,0,256,256_AL_.jpg","Calcuatte, Unabashed",2006,6.5,"adventure, crime, drama",0,1,0,0,1,1,0,0,0,0,0,0,0,    A young man negotiates his erotic and thanatotic drives.
41899,"https://m.media-amazon.com/images/M/MV5BMTI3MTgxNzkxNF5BMl5BanBnXkFtZTcwNTM0MzIzMQ@@._V1_UX256,0,256,256_AL_.jpg",A Soap,2006,6.5,"comedy, drama",0,0,0,1,0,1,0,0,0,0,0,0,0,"    32 year old Charlotte (Trine Dyrholm) could have it all, but she doesn't want it. After moving out of her boyfriend's apartment, she becomes the upstairs neighbor of Veronica (David Dencik), who is in the process of transitioning from male to female."
41900,"https://m.media-amazon.com/images/M/MV5BZDk0YTI5YWUtZGY3ZS00YzhmLTk1ZjQtNTdiNmM5ZGQwYTA1XkEyXkFqcGdeQXVyNjExODE1MDc@._V1_UX256,0,256,256_AL_.jpg",Flag,2006,6.5,"animation, sci-fi",0,0,1,0,0,0,0,0,0,0,1,0,0,"    Saeko Shirasu is a 25-year-old war frontline photo-journalist who became a celebrity after taking a picture of civilians raising a makeshift UN flag in war-torn Uddiyana. The image then became an instant symbol for peace. However, just before the peace agreement is achieved, the flag was stolen by an armed extremist group in order to obstruct the truce. The UN peacekeepers decide to covertly send in a SDC (pronounced as Seedac-Special Development Command) unit to retrieve the flag. Because of her connection with the ""Flag"" photo, Saeko Shirasu was offered the job of following the SDC unit as a frontline journalist. The SDC unit is equipped with an HAVWC (High Agility Versatile Weapon Carrier-pronounced ""havoc"") mecha armored vehicle."
41901,"https://m.media-amazon.com/images/M/MV5BMTU1NDkzMDY4OF5BMl5BanBnXkFtZTgwMTI4ODc0MDE@._V1_UX256,0,256,256_AL_.jpg",Heist School,2006,6.5,"comedy, drama",0,0,0,1,0,1,0,0,0,0,0,0,0,"    The Exam portrays the difficult school life of the high school students Mert, Sinan, Gamze, Kaan and Uluç, who suffer under the pressures of the forthcoming university entrance exam. In order to study, they must keep their grade point averages as high as possible, which is not the case yet. When one day they succeed in stealing exam questions of a lesson, they come up with the daring idea of cracking the university question database as well, in order to pass the nightmarish entrance exam. But this is easier said than done: How does one access the exam questions that are prepared by a governmental agency and are protected by armed guards like Fort Knox? There is only one thief (Jean-Claude van Damme) in the world, which possesses the skills required to do this... But how can one convince him to come to Turkey and do the job? It quickly becomes clear that the reckless idea has become a consequence-filled adventure, dragging the five friends rapidly with it."
41902,"https://m.media-amazon.com/images/M/MV5BMTI3Nzk3NDM5MF5BMl5BanBnXkFtZTcwNzU3MDg5MQ@@._V1_UX256,0,256,256_AL_.jpg",City in Heat,2006,6.5,"comedy, romance",0,0,0,1,0,0,0,0,0,1,0,0,0,"    A group of friends in their 30's meet at a bar in Buenos Aires everyday. They used to hang here as students, laughing at the world, and now they still dream of changing the world from the cafe's table. Unable discuss politics or football, the only thing they can talk about is women. When one of their friends commits suicide, a female from his past shows up to confront old feelings."
